<?xml version="1.0" encoding="utf-8"?>
<xs:schema xmlns:xs="http://www.w3.org/2001/XMLSchema">
  <xs:element name="mapa">
    <xs:complexType>
      <xs:sequence>
        <xs:element name="titulo" type="xs:string"/>
        <xs:element name="coordenadas">
          <xs:complexType>
            <xs:sequence>
              <xs:element name="latitud" type="xs:decimal"/>
              <xs:element name="longitud" type="xs:decimal"/>
            </xs:sequence>
          </xs:complexType>
        </xs:element>
        <xs:element name="pistas">
          <xs:complexType>
            <xs:sequence>
              <xs:element name="pista" type="xs:string" maxOccurs="unbounded"/>
            </xs:sequence>
          </xs:complexType>
        </xs:element>
        <xs:element name="tesoro">
          <xs:complexType>
            <xs:sequence>
              <xs:element name="nombre" type="xs:string"/>
              <xs:element name="descripcion" type="xs:string"/>
            </xs:sequence>
          </xs:complexType>
        </xs:element>
      </xs:sequence>
    </xs:complexType>
  </xs:element>
</xs:schema>